{
  "protocol_version": "0.3.0",
  "contribution_id": "contrib:robotics-aster-r1-release",
  "pack": "robotics",
  "created_at": "2026-09-21T16:00:00Z",
  "contributor": {
    "id": "agent:benchmark-subject",
    "type": "agent",
    "display_name": "Benchmark Reference Agent"
  },
  "idempotency_key": "robotics-aster-r1-release-2026-09-21",
  "summary": "Proposed Aster R1 product release with evidence-backed release date, payload, and locomotion.",
  "entities": [
    {
      "id": "entity:robot-aster-r1",
      "entity_type": "robot",
      "entity_key": "aster-r1",
      "name": "Aster R1",
      "aliases": [],
      "attributes": {
        "synthetic": true
      }
    }
  ],
  "claims": [
    {
      "id": "claim:aster-r1-release-date",
      "subject": {
        "entity_type": "robot",
        "entity_key": "aster-r1"
      },
      "predicate": "release_date",
      "value": "2026-09-21",
      "status": "proposed",
      "observed_at": "2026-09-21T16:00:00Z",
      "evidence_ids": [
        "evidence:aster-r1-release-date"
      ]
    },
    {
      "id": "claim:aster-r1-payload",
      "subject": {
        "entity_type": "robot",
        "entity_key": "aster-r1"
      },
      "predicate": "payload",
      "value": 20,
      "unit": "kg",
      "status": "proposed",
      "observed_at": "2026-09-21T16:00:00Z",
      "evidence_ids": [
        "evidence:aster-r1-payload"
      ]
    },
    {
      "id": "claim:aster-r1-locomotion",
      "subject": {
        "entity_type": "robot",
        "entity_key": "aster-r1"
      },
      "predicate": "locomotion",
      "value": "wheeled",
      "status": "proposed",
      "observed_at": "2026-09-21T16:00:00Z",
      "evidence_ids": [
        "evidence:aster-r1-locomotion"
      ]
    }
  ],
  "relations": [],
  "events": [
    {
      "id": "event:aster-r1-product-release",
      "event_type": "product_release",
      "event_key": "aster-r1-product-release-2026-09-21",
      "title": "Aster Robotics releases Aster R1",
      "summary": "Aster Robotics released Aster R1 on 2026-09-21. Q4 shipping remains a stated future plan, not a completed deployment.",
      "occurred_on": "2026-09-21",
      "date_precision": "day",
      "classification": "NEW_EVENT",
      "status": "proposed",
      "observed_at": "2026-09-21T16:00:00Z",
      "participants": [
        {
          "entity": {
            "entity_type": "company",
            "entity_key": "aster-robotics"
          },
          "role": "announcer"
        },
        {
          "entity": {
            "entity_type": "robot",
            "entity_key": "aster-r1"
          },
          "role": "product"
        }
      ],
      "attributes": {
        "synthetic": true
      },
      "evidence_ids": [
        "evidence:aster-r1-release-event-official",
        "evidence:aster-r1-release-event-media"
      ]
    }
  ],
  "evidence": [
    {
      "id": "evidence:aster-r1-release-date",
      "target": {
        "kind": "claim",
        "id": "claim:aster-r1-release-date"
      },
      "source": {
        "url": "https://example.invalid/aster/r1",
        "title": "Aster R1 official product page",
        "publisher": "Aster Robotics",
        "source_type": "first_party",
        "published_at": "2026-09-21"
      },
      "locator": "release announcement",
      "excerpt": "Aster Robotics today released Aster R1, a wheeled service robot with a rated payload of 20 kg.",
      "captured_at": "2026-09-21T14:00:00Z",
      "stance": "supports"
    },
    {
      "id": "evidence:aster-r1-payload",
      "target": {
        "kind": "claim",
        "id": "claim:aster-r1-payload"
      },
      "source": {
        "url": "https://example.invalid/aster/r1",
        "title": "Aster R1 official product page",
        "publisher": "Aster Robotics",
        "source_type": "first_party",
        "published_at": "2026-09-21"
      },
      "locator": "product description",
      "excerpt": "Aster Robotics today released Aster R1, a wheeled service robot with a rated payload of 20 kg.",
      "captured_at": "2026-09-21T14:00:00Z",
      "stance": "supports"
    },
    {
      "id": "evidence:aster-r1-locomotion",
      "target": {
        "kind": "claim",
        "id": "claim:aster-r1-locomotion"
      },
      "source": {
        "url": "https://example.invalid/aster/r1",
        "title": "Aster R1 official product page",
        "publisher": "Aster Robotics",
        "source_type": "first_party",
        "published_at": "2026-09-21"
      },
      "locator": "product description",
      "excerpt": "Aster Robotics today released Aster R1, a wheeled service robot with a rated payload of 20 kg.",
      "captured_at": "2026-09-21T14:00:00Z",
      "stance": "supports"
    },
    {
      "id": "evidence:aster-r1-release-event-official",
      "target": {
        "kind": "event",
        "id": "event:aster-r1-product-release"
      },
      "source": {
        "url": "https://example.invalid/aster/r1",
        "title": "Aster R1 official product page",
        "publisher": "Aster Robotics",
        "source_type": "first_party",
        "published_at": "2026-09-21"
      },
      "locator": "release announcement",
      "excerpt": "Aster Robotics today released Aster R1, a wheeled service robot with a rated payload of 20 kg. Shipping is planned to begin in Q4 2026.",
      "captured_at": "2026-09-21T14:00:00Z",
      "stance": "supports"
    },
    {
      "id": "evidence:aster-r1-release-event-media",
      "target": {
        "kind": "event",
        "id": "event:aster-r1-product-release"
      },
      "source": {
        "url": "https://example.invalid/trade/aster-r1-release",
        "title": "Aster R1 release coverage",
        "publisher": "Robotics Trade Journal",
        "source_type": "media",
        "published_at": "2026-09-21"
      },
      "locator": "release report",
      "excerpt": "Aster Robotics released the Aster R1 on September 21, 2026. The company says shipments are planned for Q4; the publication has not independently verified shipments.",
      "captured_at": "2026-09-21T15:00:00Z",
      "stance": "supports"
    }
  ],
  "metadata": {
    "synthetic_benchmark": true
  }
}
