{
  "protocol_version": "0.3.0",
  "contribution_id": "contrib:robotics-openbot-x1-release",
  "pack": "robotics",
  "created_at": "2026-09-19T00:00:00Z",
  "contributor": {
    "id": "agent:example",
    "type": "agent",
    "display_name": "Example Agent"
  },
  "idempotency_key": "robotics-openbot-x1-release-2026-09-19",
  "summary": "Synthetic reference contribution showing a product release claim, event, relation, and evidence chain.",
  "entities": [
    {
      "id": "entity:company-openbot-labs",
      "entity_type": "company",
      "entity_key": "openbot-labs",
      "name": "OpenBot Labs",
      "aliases": [],
      "attributes": {
        "synthetic": true
      }
    },
    {
      "id": "entity:robot-openbot-x1",
      "entity_type": "robot",
      "entity_key": "openbot-x1",
      "name": "OpenBot X1",
      "aliases": [],
      "attributes": {
        "synthetic": true
      }
    }
  ],
  "claims": [
    {
      "id": "claim:openbot-x1-release-date",
      "subject": {
        "entity_type": "robot",
        "entity_key": "openbot-x1"
      },
      "predicate": "release_date",
      "value": "2026-09-19",
      "status": "proposed",
      "observed_at": "2026-09-19T00:00:00Z",
      "evidence_ids": [
        "evidence:openbot-x1-release-claim"
      ]
    }
  ],
  "relations": [
    {
      "id": "relation:openbot-labs-manufactures-openbot-x1",
      "subject": {
        "entity_type": "company",
        "entity_key": "openbot-labs"
      },
      "predicate": "manufactures",
      "object": {
        "entity_type": "robot",
        "entity_key": "openbot-x1"
      },
      "status": "proposed",
      "observed_at": "2026-09-19T00:00:00Z",
      "attributes": {
        "synthetic": true
      },
      "evidence_ids": [
        "evidence:openbot-x1-manufacturer"
      ]
    }
  ],
  "events": [
    {
      "id": "event:openbot-x1-product-release",
      "event_type": "product_release",
      "event_key": "openbot-x1-product-release-2026-09-19",
      "title": "OpenBot X1 released",
      "summary": "Synthetic event used only to demonstrate the protocol.",
      "occurred_on": "2026-09-19",
      "date_precision": "day",
      "classification": "NEW_EVENT",
      "status": "proposed",
      "observed_at": "2026-09-19T00:00:00Z",
      "participants": [
        {
          "entity": {
            "entity_type": "company",
            "entity_key": "openbot-labs"
          },
          "role": "manufacturer"
        },
        {
          "entity": {
            "entity_type": "robot",
            "entity_key": "openbot-x1"
          },
          "role": "product"
        }
      ],
      "attributes": {
        "synthetic": true
      },
      "evidence_ids": [
        "evidence:openbot-x1-release-event"
      ]
    }
  ],
  "evidence": [
    {
      "id": "evidence:openbot-x1-release-claim",
      "target": {
        "kind": "claim",
        "id": "claim:openbot-x1-release-date"
      },
      "source": {
        "url": "https://example.com/openbot-x1",
        "title": "Synthetic OpenBot X1 release page",
        "publisher": "Example",
        "source_type": "first_party"
      },
      "locator": "release_date",
      "excerpt": "Synthetic example only.",
      "captured_at": "2026-09-19T00:00:00Z",
      "stance": "supports"
    },
    {
      "id": "evidence:openbot-x1-manufacturer",
      "target": {
        "kind": "relation",
        "id": "relation:openbot-labs-manufactures-openbot-x1"
      },
      "source": {
        "url": "https://example.com/openbot-x1",
        "title": "Synthetic OpenBot X1 release page",
        "publisher": "Example",
        "source_type": "first_party"
      },
      "locator": "manufacturer",
      "excerpt": "Synthetic example only.",
      "captured_at": "2026-09-19T00:00:00Z",
      "stance": "supports"
    },
    {
      "id": "evidence:openbot-x1-release-event",
      "target": {
        "kind": "event",
        "id": "event:openbot-x1-product-release"
      },
      "source": {
        "url": "https://example.com/openbot-x1",
        "title": "Synthetic OpenBot X1 release page",
        "publisher": "Example",
        "source_type": "first_party"
      },
      "locator": "release announcement",
      "excerpt": "Synthetic example only.",
      "captured_at": "2026-09-19T00:00:00Z",
      "stance": "supports"
    }
  ]
}
